1.1.1,Respondent information
3.3.7,"Do you prepare assurance reports to prove internal control operations and procedures are efficient, effective, robust and satisfy their control objectives (e.g. in line with technical release AAF/0106 of the Institute of Chartered Accountants in England and Wales or equivalent)? If yes, please provide a copy of the report."
3.3.8,Please highlight any concerns raised in any of the above audits together with actions to remediate these points.
3.3.9,Briefly describe the follow-up procedures that exist to ensure internal/ external audit or regulatory audit recommendations are implemented.
3.3.10,"Are there any open items from the last recommendations? If yes, please provide details."
3.3.11,Are all key operating procedures and escalation procedures clearly documented and accessible to all staff?
3.3.12,"Please confirm that your external auditors verify that assets held by you are in your custody and control.  If no, please comment."
3.3.13,"In the past 12 months, please confirm that such external audits have taken place in respect of assets recorded in your books and are reconciled with the Central Securities Depository / Registrar or any other sub-custodian?’"
3.4.1,Please confirm that you have disaster recovery plans (DRP).
3.4.2,"In the last 12 months have there been any material changes to these plans? If yes, please provide details."
3.4.3,Are these plans reviewed by your regulator?
3.4.4,Who within your organisation has oversight over your DRP?
3.4.5,Who has authority to activate your DRP?
3.4.6,How often is your DRP tested? What was the date of the last test?
3.4.7,"Was the last DRP test successful? If not, please describe items that require remediation and confirm that a remediation plan is in place."
3.4.8,Is your DRP testing live or simulated?
3.4.9,Does the DRP testing include financial market infrastructures?
3.4.10,Does the DRP testing include other third parties?
3.4.11,Please confirm that testing replicates a full business day.
3.4.12,"Are the results of the DRP test audited by internal or external auditors? If so, please provide a copy of the reports."
3.4.13,How do you monitor gaps from these findings and ensure action is taken to remediate these issues?
3.4.14,How and when would clients be advised in the event of a disaster?
3.4.15,"In a disaster event, how soon do you commit to reconstituting your system/parallel system?"
3.4.16,"In a disaster event, how soon are you able to revert to normal business operations?"
3.4.17,"Are there any limitations to your system capabilities whilst in DR mode? If yes, please provide details."
3.4.18,Do you back up your data in real time?
3.4.19,"In the last 12 months have you invoked your DRP? If yes, please provide details."
3.4.20,Did the results comply with your plan?
3.4.21,How far apart are your primary and secondary processing hardware located?
3.4.21.1,Are your primary and secondary processing hardware located in the same power grid?
3.4.21.2,"If your primary and secondary processing hardware are located in the same power grid, how do you mitigate this risk?"
3.4.22,Do you operate a “hot” disaster recovery site?
3.4.23,Are backup systems available at the primary data centre?
3.4.24,"If the primary lines of communication between your primary data centre and the back-up site fail, what contingency measures are in place?"
3.5.1,"Does your organisation have a documented cybersecurity policy in place? If so, please provide a copy or overview."
3.5.1.1,Please confirm that your staff receive relevant training about this policy.
3.5.2,Please provide an overview of your policy for continuity of business in the event of a large data breach or cyber attack against your organisation.
3.5.3,"In the last 12 months have there been any changes to the policy? If yes, please detail."
3.5.4,Please advise how often you review the policy.
3.5.5,Please provide (as an attachment) a diagram showing where your cybersecurity function resides and who it reports to.
3.5.6,How does your organisation identify which business functions carry a cyber risk?
3.5.7,"Do you conduct ongoing testing and monitoring processes to ensure that all internal and external connectivity and system configurations are not at risk of cybersecurity breaches?  If yes, please provide details and indicate frequency."
3.5.8,What technological controls and protections are in place for your systems and networks?
3.5.8.1,Does your organisation use multi-factor authentication?
3.5.8.2,"Where your organisation has outsourced activities or functions to a third-party provider, is your cyber risk exposure documented?"
3.5.9,What measures does your organisation have to ensure early detection of a cyber attack?
3.5.10,What is the agreed resumption time for critical operations following a cyber attack?
3.5.11,How would you advise clients of a successful cyber attack against your organisation?
3.5.12,"In the last 12 months has your organisation been subject to a cyber attack that impacted the service you provide to us?  If yes, please provide details."
3.5.13,Are the following elements of your cybersecurity framework tested pre and post deployment of changes?
3.5.14,"For cloud technology and associated cybersecurity risks, please confirm:
(i) that you have procedures and controls in place to protect our information from mishandling and  theft;"
3.5.15,Does your organisation conduct dark web searches for signs of a breach (internet protocol or customer/client personally identified information for sale)?
3.5.16,Is your organisation aware of SWIFT’s Customer Security Program (CSP)?
3.5.17,Does your organisation ensure compliance with SWIFT’s CSP controls?
3.5.18,Does your organisation respond to requests for your institution’s attestations?
3.5.19,Does your organisation request the attestation details of your counterparties and incorporate the responses into ongoing relationship and risk management programs?
3.6.1,"Please confirm that you have BCP, including alternate offices, power, communications and all necessary facilities."
3.6.2,"In the last 12 months have there been any material changes to the BCP? If yes, please provide details."
3.6.3,Is the organisation compliant with all current regulatory requirements for BCP in each of the countries where you provide securities services and/or client money services?
3.6.4,In the last 12 months have there been any new BCP regulatory requirements issued?
3.6.5,Who within your organisation has oversight and control over BCP?
3.6.6,Who has authority to activate your BCP?
3.6.7,How often is your BCP tested? What was the date of the last test?
3.6.8,Is testing completed during business hours?
3.6.9,"Was your last BCP test successful? If no, please describe items that required remediation and confirm that a remediation plan is in place."
3.6.10,Is your BCP testing conducted in a live or simulated environment?
3.6.11,Does your BCP testing include Financial Market Infrastructures?
3.6.12,Does your BCP testing include any other third parties?
3.6.13,"Are the results of your BCP test audited by internal or external auditors? If yes, please provide a copy of the report."
3.6.14,How do you monitor gaps from these findings and ensure action is taken to remediate these issues?
3.6.15,How and when would clients be advised in the event of the BCP being activated in a live environment?
3.6.16,"Following a BCP event, how soon are you able to revert to business as usual (BAU)?"
3.6.17,"Are there any limitations to your business capabilities whilst in BCP mode? If yes, please provide details."
3.6.18,"In the last 12 months have you invoked your BCP? If yes, please provide details."
3.6.19,"If invoked, did the results comply with your plan?"
3.6.20,Are you willing to allow us to review the findings of your last full business continuity test?
3.6.21,"Specifically for securities services and/or client money, state the distance of the contingency site(s) from your primary location."
3.6.21.1,Are your primary and secondary processing hardware located in the same power grid?
3.6.21.2,"If your primary and secondary processing hardware are located in the same power grid, how do you mitigate this risk?"
3.6.22,Is the business contingency site a hot site?
3.6.23,"Is the business contingency site shared? If yes, please provide details."
3.6.24,Please specify the percentage of staff defined as critical to your business continuity arrangements.
3.6.26,"Please confirm that your contingency site has all the necessary communications, linkages, infrastructure interfaces, work stations, hardware and systems applications to resume business operations."
3.6.27,Please state how long you can continue to operate from the BCP site.
3.6.28,Is it possible for employees to access systems remotely (e.g. from home or other branches/offices)?
3.6.29,What is the contingency should your primary method of communications with your clients fail (e.g. SWIFT)?
3.6.30,"Please confirm if an alternative means of communication is in place with the following. If yes, please state the alternative method (e.g. email, fax)"
3.6.31,What percentage of staff are able to work from home?
3.6.32,Are there any restrictions or exceptions to working from home within your organisation?
3.6.33,"Does your organisation have a dedicated pandemic plan? If no, please explain why?"
3.6.34,Do you have a pandemic plan covering mass absenteeism?
3.6.35,"As part of your pandemic plan, do you have processes to address the following?"
3.6.36,In the past 12 months has your pandemic plan been tested?
3.6.37,"If yes, were there any areas of material concern noted as part of your pandemic plan testing?"
3.6.38,"During a pandemic, please confirm that your organisation can accept digital/electronic signing/scanning of legally binding and related documents?"
3.6.39,"During a pandemic, please advise if there are any known restrictions within the local market in accepting digital/electronic signing/scanning of legally binding and related documents?"
3.6.42,"Where you have offshored/centralised, outsourced, delegated (to a sub custodian) or are dependent upon a third-party provider, please confirm that adequate plans are in place to minimise any impact from a pandemic."
3.6.43,Please confirm that steps have been taken to address any potential impacts with market infrastructures or your regulator resulting from a pandemic?
3.7.1,"Please confirm that your group has a policy covering (a) anti-money laundering (AML), (b) counter terrorist financing (CTF), (c) anti-bribery and corruption (ABC), (d) know your client (KYC) (e) politically exposed persons (PEP) and (f) sanctions. Please specify how frequently you and your regulator review these policies and the name of the regulator undertaking the review."
3.7.2,Please confirm that the policies in the above question have been implemented in your jurisdiction and that you have a process in place to monitor and action changes in applicable laws and regulation?
3.7.3,"Do you have a whistle-blower policy in place? If yes, please provide details of this policy."
3.7.4,"Do you have a conflicts of interest policy in place? If yes, please provide a copy of this policy."
3.7.5,"Do you have a dedicated AML compliance team at both group and local level who is responsible for the implementation, monitoring, escalation, reporting and management of all policies related to combating financial crime?"
3.7.6,Describe your process for monitoring changes to any regulation or legislation that may affect your financial crime policies.
3.7.7,"In the last 12 months have there been any material changes to your policies to combat financial crime? If yes, please provide details."
3.7.8,"How does your organisation identify, report (e.g. including to whom) and monitor suspicious securities and cash transactions?"
3.7.9,"Do you have a systematic and technological capability to ensure that any suspicious securities and cash transactions are identified, monitored and reported? If not, please describe how you ensure that suspicious transactions are adequately monitored and managed and how your system and/or process is kept up-to-date?"
3.7.10,"In the last 12 months have there been any breaches of your AML, CTF, ABC, KYC, PEP or sanctions policies reported to your regulator? If yes, please elaborate and state what remedial actions were taken."
3.7.11,"In the last 5 years, has a regulator or other independent body applied any publicly disclosed warnings, sanctions, fines or penalties on your bank/group related to your AML, CTF, ABC, KYC, PEP or sanctions procedures? If yes, briefly describe the circumstances and include details of the amount of any fines or sanctions and regulatory body concerned."
3.7.12,"In the last 12 months have there been any regulatory investigations into bribery against your organisation, its parent, its employees or affiliates?"
3.7.13,"Please confirm that your staff servicing our activities receive regular training on AML, CTF, ABC, KYC, PEP and sanctions issues. Please describe the frequency and scope of the training provided. Please advise if it is mandatory and if attendance is monitored."
3.7.14,"Is your organisation a member of the Wolfsberg Group and has your organisation completed the Wolfsberg Group Questionnaire on AML? If yes, please provide a copy as an attachment."
3.7.15,How frequently do you perform your AML/KYC screening checks on your clients?
3.7.16,Please describe the process that your organisation employs for completing AML/KYC checks.
3.7.17,"Does your organisation adhere to a record retention period imposed by legislation? If yes, please provide us with the record retention period. If no, please provide us with the record retention period applied by your organisation."
3.7.18,Have you adopted a risk-based approach for the assessment of KYC and AML checks or do you treat all client relationships in the same way? Please outline your approach to each.
3.7.19,Please outline your methodology when reviewing and assessing PEPs.
3.7.20,"Please confirm that your organisation has procedures to ensure that no accounts are set up, nor any type of transaction (cash, securities or otherwise) is made to the following."
3.7.21,"Do you have an automated systematic technological capability to ensure the above policies are implemented? If no, please describe how this is achieved and how the system is kept up-to-date."
3.7.22,"Does your institution perform sanction screening against the OFAC, UN and EU sanctions lists at the time of onboarding and for each transaction?"
3.7.23,Please provide a copy of your US Patriot Act compliance certificate.
3.7.24,Please give a detailed overview of your compliance monitoring procedures including your sanctions monitoring process.
3.7.25,"Which department in your organisation is responsible for implementing, monitoring, escalating, reporting, and managing sanctions?"
3.7.26,"Does your institution have policies and procedures to ensure that reasonable measures are taken to ensure that your institution does not knowingly transact business with sanctioned individuals, entities and countries?"
3.7.26.1,Please provide a list of countries for which your institution has sanctions related controls and procedures.
3.7.27,Does your organisation operate a formal code of conduct for procurement?
3.8.1,"In the last 12 months have there been any changes to data protection and privacy legislation in your jurisdiction or in the jurisdiction of your group? If yes, please provide details"
3.8.2,Are you required to report data breaches to your regulators?
3.8.3,"In the last 12 months have you reported any data breaches to your regulators? If yes, please provide details."
3.8.4,"Where you may be in possession of personal data, belonging to our employees or clients, please confirm that you have policies and procedures in place to ensure compliance with applicable data protection legislation including data processing and storage?"
3.8.5,Are you based in the European Economic Area?
3.8.6,Please confirm that personal data is not used to sell additional products beyond our relationship.
3.8.7,"Do you have a data breach policy in place? If yes, please briefly describe such policies and explain how and when you would notify us of a data breach."
3.8.8,"In the last 12 months have there been any changes in your formal data protection policy? If yes, please attach a copy of the revised policy."
3.8.9,In the last 12 months have there been any changes in the formal data protection policy in relation to sharing of data with other business units and /or third parties/affiliates?
3.8.10,"Are there any exemptions from your data protection policy? If yes, please provide details."
3.9.1,"Do you have a statement on modern slavery in your business and supply? If yes, please provide a copy or a link to where this can be found on your website"
3.9.2,"If not covered in a separate statement, please provide details of."
3.9.3,"Do you support and respect globally recognised principles and standards (such as principles of UN Global Compact, ILO standards) promoting humane and safe work environments and respecting employee rights?"
3.9.4,"Please confirm that your organisation has a people screening process for new joiners, including at a minimum: verification of their identity and age, physical address, legal right to work and employment history, and checks on criminal history, credit history and bankruptcy, and against relevant government and sanctions lists."
3.9.5,"Please confirm that you have a firm commitment to enable equality of opportunity in employment, skill development and career enhancement, ensure workplace cultures that promote diversity and inclusion, and enforce adequate procedures and policies to ensure the workplace is free from discrimination, harassment, victimisation or any other form of inappropriate behaviour or abuse on any grounds."
3.9.6,"Does your organisation’s procurement policy include corporate social responsibility requirements?  If yes, please provide a brief overview."
3.9.7,"Has your organisation adopted corporate social responsibility policies including considering the use of diverse suppliers? Please provide the latest available corporate social responsibility report or any other document assessing your organisation’s corporate achievements in environmental, social and governance areas."
4.1.1,Please outline any enhancements to your operational reporting capability planned for the next 12 months.
4.1.2,"Please outline any enhancements to your market infrastructures' (e.g. CCP, CSD) operational reporting capabilities planned for the next 12 months."
4.2.1,"Do you have a data security policy? If yes, please attach or provide details."
4.2.2,Does your organisation have spyware protection installed on all servers and workstations?
4.2.3,Please outline your anti spyware checking procedures and confirm that your anti spyware software is updated whenever a new version is released.
4.2.4,Please outline your policy on the deployment of antivirus products and the applications that this covers
4.2.5,Please outline your antivirus checking procedures and confirm that your antivirus software is updated whenever a new version is released.
4.2.6,"In the last 12 months have there been any external security breaches of your system? If yes, please outline and advise what you have done to minimise the likely recurrence of such a breach."
4.2.7,In the last 12 months has your company been mentioned in the media regarding an information security event?
4.2.8,How is internet access policed to prevent misuse by your staff?
4.2.9,Outline how your systems are protected from unauthorised use?
4.2.10,"Do you have procedures in place which allow access to programs and data to individual employees with different levels of authorised access? If yes, please outline."
4.2.11,Please outline your process for incorporating system changes and releases into the live environment?
4.2.12,In what circumstances do you prenotify clients of changes to your systems?
4.3.1,"In the last 12 months have there been any major developments or enhancements to your systems that support your securities services and/or client money business? If yes, please detail."
4.3.2,Briefly outline any major systems developments or enhancements to your securities services and/or client money businesses that are planned for the next three years. Indicate the planned timescales.
4.3.3,Please describe your change control policy/process relating to major IT implementations.
4.3.4,"Are there any plans to outsource your systems during the next 12 months? If yes, please describe such plans."
4.4.1,"In the last 12 months have you had system outages or slowdowns that have impacted your ability to service your clients? If yes, please detail how many events there have been."
4.4.2,In the last 12 months what has been your average core securities services processing system uptime ?
4.4.3,What percentage of your system capacity do you use on a daily basis?
4.4.4,In the last 12 months have there been any changes to your end-to-end system infrastructure?
4.5.1,What time period do you allow between the availability of vendor high priority security patches (to operating systems/network devices/applications) and their implementation to production environments?
4.5.2,Are security requirements included in the software development lifecycle documentation?
4.5.3,"Is client data ever used in the test, development, or QA environments?"
4.6.1,"Is operational resilience part of your Board or Executive Management agenda, discussion and decision-making process?"
4.6.3,Does your criticality assessment/ resilience planning include critical technology services?
4.6.4,How frequently does executive management review your operational resilience plan?
4.6.5,Is the resilience planning of your organisation (including mapping of critical products and services) a regulatory requirement?
4.6.6,How are organisational service deficiencies identified?
4.6.7,"In the last 12 months have all identified resilience related deficiencies been remediated, evaluated, and addressed?"
4.6.8,Please confirm you have a framework in respect of succession planning?
5.1.1,"In the last 12 months have there been any material changes to your settlement processes? If yes, please describe."
5.1.2,Please confirm which of the following controls are in place to ensure that an individual client’s securities are used only to settle that client’s trades (e.g. not used to settle trades belonging to either yourself or your other clients).
5.1.3,"In the last 12 months have there been any changes that have led to a reduction or increase in manual processing for the items below? If yes, please outline."
5.1.4,"In the last 12 months have there been any material changes to market processes, fails processing or penalties? If yes, please describe."
5.1.5,Please describe how any of the changes above affect the levels of manual intervention in these processes.
5.1.6,"Is settlement in your market true DVP (i.e. simultaneous, final and irrevocable)? If no, please advise how you reduce settlement risk."
5.2.1,"In the last 12 months have there been any changes or enhancements that have been made to your income information sources or market information sources ? If yes, please advise."
5.2.2,"In the last 12 months have there been any changes or enhancements made to your organisation’s corporate actions sources or market information sources? If yes, please advise."
5.2.3,"In the last 12 months have there been any changes or enhancements to your proxy voting service? If yes, please advise."
5.2.4,Have any of the changes to your proxy voting service affected the levels of manual intervention in these processes?
5.3.1,"In the last 12 months have there been any changes or enhancements to your  taxation reclaim, relief at source or tax voucher process. If yes, please comment."
5.3.2,Have any of the changes above affected the levels of manual intervention in these processes?
5.3.3,Does your jurisdiction have an IGA (Intergovernmental Agreement) in place to implement FATCA?
5.3.4,"If your jurisdiction does not have an IGA, have you agreed to the terms of a FATCA FFI (Foreign Financial Institution) agreement and registered with the IRS?"
5.3.5,"Is your organisation compliant with the terms of the IGA? If no, please state your plans to become compliant."
5.3.6,"Is your organisation FATCA compliant? If no, please state your plans to become compliant."
5.3.7,Has your organisation registered with the IRS and received a Global Intermediary Identification Number (GIIN)?
5.3.8,Is your organisation treated as a Foreign Financial Institution (FFI) or a Limited FFI under the IRS definition?
5.3.9,Does your organisation inform the IRS of any US client's account details?
5.3.10,Is the reporting to the IRS performed automatically or manually?
5.4.1,"In the last 12 months have there been any changes to your treasury, FX and cash management products and services? If yes, please provide details."
5.4.2,"In the last 12 months have there been any changes to any national guarantee and/or compensation scheme in place? If yes, please provide details."
5.4.3,"In the last 12 months have there been any changes regarding FX policies or currency restrictions? If yes, please provide details."
5.4.4,"In the last 12 months, have there been any changes to the penalties applied by your organization for ‘excess’ liquidity balances? If yes, please provide details"
5.4.5,"In the last 12 months have there been any changes to the types of cash accounts available in your market? If yes, please detail."
